event_id,date,published_date,country,sector,domain,entity,event_title,event_summary,source_name,source_type,source_url,source_tier,secondary_sources,space_compute_relevance_score,industry_impact_score,novelty_score,total_score,priority,reason_for_priority,include_in_report,implication,meaning_for_us,next_watch,analyst_note,source_discovery_flag
W29-E062,2026-07-14,2026-07-14,China,政策,Policy,,2026航天级FPGA行业发展现状与未来趋势_中研普华_中研网,"航天级FPGA已形成配套完整、需求刚性的专业化细分市场,是高端航天电子产业的核心细分赛道。从供给端来看,该行业技术壁垒和认证门槛极高,对芯片设计、加固工艺、可靠性测试、航天资质认证有着严苛标准,行业准入门槛远高于普通芯片领域,长期以来形成了专业化、精细化的供给格局,优质产能和成熟技术资源高度集中。航天级FPGA行业发展现状与未来趋势航天级FPGA行业是一个典型的“小而精、专而强”的专业化细分市场。与消费电子或工业级FPGA不同,航天级产品必须经受高能粒子辐射、极端温度波动(-55°C至+125°C)和真空环境的严峻考验,其设计、工艺、测试与认证标准远高于普通芯片领域。中研普华研究院撰写的《2026年全球航天级FPGA行业市场规模、领先企业国内外市场份额及排名》显示:航天级FPGA行业正站在从“传统刚需”向“规模化增量”跃迁的关键节点——全球商业航天的大爆发、航天装备智能化升级的纵深推进,以及核心元器件自主可控的国家战略需求,正共同驱动这一高门槛赛道进入价值重估与快速扩张的新周期。一、市场发展现状全球航天级FPGA市场已形成可观的规模体量。据行业研究机构统计,2024年全球抗辐射加固FPGA市场估值约在4.65亿至8.6亿美元区间,预计到2030年前后有望突破百亿元人民币量级。从增长动能来看,市场正在从过去“缓慢增长、稳定配套”的传统模式,向“技术迭代加速、应用场景拓宽、适配性持续优化”的快速扩张通道切换。从竞争格局来看,全球市场呈现典型的“寡头主导、高度集中”特征。AMD(赛灵思)、Microchip",www.chinairn.com,Web,https://www.chinairn.com/scfx/20260714/175142750.shtml,Watch,,4,5,3,4.10,B,编辑降级：行情/趋势/预告或非原子事件,Brief,可能影响太空算力的部署节奏、硬件供给或应用边界。,用于校准产业路线、合作对象和资本节奏。,跟踪后续官方文件、技术参数、订单或融资交割。,Pass A discovery; Pass C date-window structured result,Yes
W29-E063,2026-07-15,2026-07-15,China,科技,Technology,,紫光国微:公司在宇航应用领域已推出了宇航用FPGA等多款产品_腾讯新闻,"每经AI快讯,紫光国微7月15日在互动平台表示,公司在宇航应用领域已推出了宇航用FPGA、回读刷新芯片、存储器、总线接口等多款产品,具备完整的宇航用系统解决方案,已得到核心用户应用,公司在持续地推广应用。每日经济新闻",news.qq.com,Web,https://news.qq.com/rain/a/20260715A0ASYS00,Watch,,2,3,3,2.50,B,正文覆盖校准：官方或技术链补充信号，仅作Brief,Brief,作为地面算力与芯片供给侧对照。,用于校准产业路线、合作对象和资本节奏。,跟踪后续官方文件、技术参数、订单或融资交割。,Pass A discovery; Pass C date-window structured result,Yes
W29-E064,2026-07-13,2026-07-13,China,科技,Technology,,英特尔推出太空级Starfire芯片 专为极端环境打造并计划2026年出样。_热点播报_太平洋科技资讯中心,英特尔推出太空级Starfire芯片,news.pconline.com.cn,Web,https://news.pconline.com.cn/2178/21786140.html,Watch,,2,3,3,2.50,B,正文覆盖校准：官方或技术链补充信号，仅作Brief,Brief,作为地面算力与芯片供给侧对照。,用于校准产业路线、合作对象和资本节奏。,跟踪后续官方文件、技术参数、订单或融资交割。,Pass A discovery; Pass C date-window structured result,Yes
W29-E065,2026-07-15,2026-07-15,China,科技,Technology,,仕佳光子:拟定增募资不超过28亿元 用于高速AWG芯片及光互连组件产能建设项目等-上海证券报·中国证券网,仕佳光子:拟定增募资不超过28亿元,www.cnstock.com,Web,https://www.cnstock.com/commonDetail/745603,S_Core,,2,4,3,2.80,B,外圈对照,Brief,作为地面算力与芯片供给侧对照。,用于校准产业路线、合作对象和资本节奏。,跟踪后续官方文件、技术参数、订单或融资交割。,Pass A discovery; Pass C date-window structured result,Yes
W29-E066,2026-07-16,2026-07-16,China,科技,Technology,,紫光国微:已推出多款宇航用产品并得到核心用户应用-顶端新闻,"7月15日,紫光国微在互动平台表示,公司在宇航应用领域已推出了宇航用FPGA、回读刷新芯片、存储器、总线接口等多款产品,具备完整的宇航用系统解决方案,已得到核心用户应用,公司在持续的推广应用。",www.topnews.cn,Web,https://www.topnews.cn/news/145ED6E741BF4576,Watch,,2,3,3,2.50,B,正文覆盖校准：官方或技术链补充信号，仅作Brief,Brief,作为地面算力与芯片供给侧对照。,用于校准产业路线、合作对象和资本节奏。,跟踪后续官方文件、技术参数、订单或融资交割。,Pass A discovery; Pass C date-window structured result,Yes
W29-E067,2026-07-15,2026-07-15,China,融资,semiconductor,,仕佳光子定增募资不超28亿元 投建高速AWG芯片及光互连组件产能建设等项目,"7月15日晚间仕佳光子(688313)公告,公司拟定增募资不超28亿元,扣除发行费用后拟用于高速AWG芯片及光互连组件产能建设项目、连续波(CW)激光器芯片及COC产业化项目、高密度光互连器件(MPO/MMC)产能扩建项目并补充流动资金。据披露,高速AWG芯片及光互连组件产能建设项目建设周期为3年,项目总投资7.69亿元,投资内容包括场地投入、设备购置及安装、基本预备费、铺底流动资金等。项目主要用于提升公司高速AWG芯片及光互连组件的生产制造、封装耦合、检测筛选及可靠性验证能力。仕佳光子表示,公司目前高速AWG芯片及光互连组件产能利用率处于较高水平,现有产能已难以完全满足下游客户持续增长的交付需求。公司晶圆芯片、AWG芯片及MT-FA组件等产品的生产涉及芯片加工、精密装配、光学耦合、封装测试、可靠性验证等多个环节,产能释放不仅受设备数量制约,也受关键工序节拍、测试筛选能力、良率水平和人员组织能力影响。随着产能趋紧,部分产品交付周期有所延长,对公司进一步承接客户订单和拓展市场份额形成一定制约。本项目实施后,公司将通过新增生产、封装、测试及可靠性验证等关键环节能力,提升重点无源产品的规模化制造能力和批量交付能力,缓解现有产能瓶颈,保障客户订单稳定交付,并为公司进一步扩大高端无源产品市场份额、提升经营规模和盈利能力提供重要支撑。连续波(CW)激光器芯片及COC产业化项目建设周期为3年,总投资金额14.56亿元,投资内容涵盖场地投入、设备购置及安装、基本预备费、铺底流动资金等。项目建成后,将提升公司100mW",stcn.com,Web,https://stcn.com/article/detail/4021758.html,S_Core,,2,4,3,2.80,B,外圈对照,Brief,作为地面算力与芯片供给侧对照。,用于校准产业路线、合作对象和资本节奏。,跟踪后续官方文件、技术参数、订单或融资交割。,Pass A discovery; Pass C date-window structured result,Yes
W29-E068,2026-07-14,2026-07-14,China,科技,Technology,,激光辐照加热系统项目竞选结果公告-航空学院,激光辐照加热系统项目竞选结果公告,hangkong.nwpu.edu.cn,Web,https://hangkong.nwpu.edu.cn/info/1020/54294.htm,Watch,,1,3,3,2.00,C,弱相关,Exclude,作为地面算力与芯片供给侧对照。,用于校准产业路线、合作对象和资本节奏。,跟踪后续官方文件、技术参数、订单或融资交割。,Pass A discovery; Pass C date-window structured result,Yes
W29-E069,2026-07-13,2026-07-13,China,融资,semiconductor,,"芯片ETF易方达融资净买入772.79万元,居可比基金前2_腾讯新闻","2026年7月10日,芯片ETF易方达(516350.SH)收跌6.20%,成交4.42亿元。获融资买入2066.75万元,融资偿还1293.96万元,融资净买入772.79万元,居可比基金前2。(数据来源:Wind)",news.qq.com,Web,https://news.qq.com/rain/a/20260713A03D8G00,Watch,,2,4,4,3.00,C,编辑降级：行情/趋势/预告或非原子事件,Database_Only,作为地面算力与芯片供给侧对照。,用于校准产业路线、合作对象和资本节奏。,跟踪后续官方文件、技术参数、订单或融资交割。,Pass A discovery; Pass C date-window structured result,Yes
W29-E070,2026-07-15,2026-07-15,China,科技,Technology,,2026星间激光通信行业发展现状与产业链分析_中研普华_中研网,"星间激光通信是以红外激光为信号载波,在卫星之间构建真空高速传输链路的空间光通信产业体系,区别于传统射频微波星间通信,依靠高精度捕获、跟踪、瞄准ATP系统实现同轨、跨轨、高低轨航天器之间大容量数据互通。是空天地一体化信息网络的关键底层支撑,属于十五五商业航天与空间信息基础设施重点攻坚赛道。星间激光通信行业发展现状与产业链分析一、引言星间激光通信,这个曾经只存在于航天实验室中的前沿概念,正以前所未有的速度从技术验证的象牙塔迈入规模化组网的产业主战场。中研普华研究院撰写的《2026-2030年中国星间激光通信行业深度研究及未来发展前景研判报告》显示:当前行业的核心叙事在于:低轨巨型星座的规模化组网已将星间激光链路从“选配”升级为“标配”,行业正从技术试点全面迈入产业化成熟的关键窗口期。理解这场变革的深度与广度,是把握星间激光通信行业市场规模与发展走向的基本前提。二、市场发展现状2.1",www.chinairn.com,Web,https://www.chinairn.com/scfx/20260715/171017109.shtml,Watch,,4,3,3,3.50,B,编辑降级：行情/趋势/预告或非原子事件,Brief,可能影响太空算力的部署节奏、硬件供给或应用边界。,用于校准产业路线、合作对象和资本节奏。,跟踪后续官方文件、技术参数、订单或融资交割。,Pass A discovery; Pass C date-window structured result,Yes
W29-E071,2026-07-16,2026-07-16,China,科技,Technology,,星间激光通信研究报告_2026-2030年中国星间激光通信行业深度研究及发展前景研判报告_中国行业研究网,﻿,www.chinairn.com,Web,https://www.chinairn.com/report/20260716/170907250.html,Watch,,1,3,3,2.00,C,弱相关,Exclude,作为地面算力与芯片供给侧对照。,用于校准产业路线、合作对象和资本节奏。,跟踪后续官方文件、技术参数、订单或融资交割。,Pass A discovery; Pass C date-window structured result,Yes
W29-E072,2026-07-13,2026-07-13,China,科技,Technology,,2026年7月13日航道水情通报-水运频道,2026年7月13日航道水情通报,jtt.hunan.gov.cn,Web,http://jtt.hunan.gov.cn/jtt/hnsy/syfw/sqtb/202607/t20260713_34024957.html,S_Core,,1,3,3,2.00,C,弱相关,Exclude,作为地面算力与芯片供给侧对照。,用于校准产业路线、合作对象和资本节奏。,跟踪后续官方文件、技术参数、订单或融资交割。,Pass A discovery; Pass C date-window structured result,Yes
W29-E073,2026-07-17,2026-07-17,China,科技,Technology,,深证成分指数(2026年07月13日-2026年07月17日),深证成分指数(2026年07月13日-2026年07月17日),www.cei.cn,Web,https://www.cei.cn//defaultsite/s/article/2026/07/17/4b4ff607-9d914745-019f-6eff65db-6267_home.html?referCode=jrzsszc&columnId=4028c7ca-37115425-0137-1156d6ff-0567,Watch,,1,3,3,2.00,C,弱相关,Exclude,作为地面算力与芯片供给侧对照。,用于校准产业路线、合作对象和资本节奏。,跟踪后续官方文件、技术参数、订单或融资交割。,Pass A discovery; Pass C date-window structured result,Yes
W29-E074,2026-07-14,2026-07-14,China,科技,Technology,,2026年7月14日航道水情通报-水运频道,2026年7月14日航道水情通报,jtt.hunan.gov.cn,Web,http://jtt.hunan.gov.cn/jtt/hnsy/syfw/sqtb/202607/t20260714_34026008.html,S_Core,,1,3,3,2.00,C,弱相关,Exclude,作为地面算力与芯片供给侧对照。,用于校准产业路线、合作对象和资本节奏。,跟踪后续官方文件、技术参数、订单或融资交割。,Pass A discovery; Pass C date-window structured result,Yes
W29-E075,2026-07-13,2026-07-13,China,科技,Technology,,7-14预测_潘123_淘股吧,添加图片,www.tgb.cn,Web,https://www.tgb.cn/a/2toNpU5VtXA,Watch,,1,3,3,2.00,C,弱相关,Exclude,作为地面算力与芯片供给侧对照。,用于校准产业路线、合作对象和资本节奏。,跟踪后续官方文件、技术参数、订单或融资交割。,Pass A discovery; Pass C date-window structured result,Yes
W29-E076,2026-07-13,2026-07-13,China,科技,Technology,,"2026年7月13日,收盘数据~ - 今日头条","动感日常分享多种运动项目与日常锻炼内容,记录运动过程、训练感悟与健身干货,倡导健康生活方式,收获活力与自信。关注",www.toutiao.com,Web,https://www.toutiao.com/article/7661920869421187590/,Watch,,1,3,3,2.00,C,弱相关,Exclude,作为地面算力与芯片供给侧对照。,用于校准产业路线、合作对象和资本节奏。,跟踪后续官方文件、技术参数、订单或融资交割。,Pass A discovery; Pass C date-window structured result,Yes
W29-E077,2026-07-15,2026-07-15,China,融资,commercial_space,,中国卫星(600118)龙虎榜数据(07-15) _ 东方财富网,"交易所2026年7月15日公布的交易公开信息显示,中国卫星因成为非S证券连续三个交易日内收盘价格跌幅偏离值累计达到20%的证券上榜。中国卫星当日收报73.92元,涨跌幅-10.00%,换手率7.11%,成交额64.27亿。异常期间7月14日至7月15日,期间涨幅-19.00%,累计偏离值-20.07%,区间成交额85.61亿。免责声明:本文基于AI生产,仅供参考,不构成任何投资建议,据此操作风险自担。东方财富发布此内容旨在传播更多信息,与本平台立场无关。东方财富力求但不保证数据的完全准确,如有错漏请以中国证监会指定上市公司信息披露媒体为准,东方财富不对因该资料全部或部分内容而引致的盈亏承担任何责任。用户个人对服务的使用承担风险,东方财富对此不作任何类型的担保。",finance.eastmoney.com,Web,https://finance.eastmoney.com/a/202607153807484187.html,Watch,,4,3,4,3.70,C,编辑降级：行情/趋势/预告或非原子事件,Database_Only,可能影响太空算力的部署节奏、硬件供给或应用边界。,用于校准产业路线、合作对象和资本节奏。,跟踪后续官方文件、技术参数、订单或融资交割。,Pass A discovery; Pass C date-window structured result,Yes
W29-E078,2026-07-14,2026-07-14,China,政策,Policy,,关于重复使用运载火箭科研项目(第三批)指南发布的通告,关于重复使用运载火箭科研项目(第三批)指南发布的通告,www.cnsa.gov.cn,Web,https://www.cnsa.gov.cn/n6758823/n6758839/c10762062/content.html,S_Core,,4,3,4,3.70,A,中圈载体,Yes,可能影响太空算力的部署节奏、硬件供给或应用边界。,用于校准产业路线、合作对象和资本节奏。,跟踪后续官方文件、技术参数、订单或融资交割。,Pass A discovery; Pass C date-window structured result,Yes
W29-E079,2026-07-13,2026-07-13,China,科技,Technology,,长征五号遥十四火箭安全运抵文昌航天发射场将执行嫦娥七号发射任务,"据中国载人航天工程办公室消息,2026年7月13日,将执行嫦娥七号任务的长征五号遥十四运载火箭安全运抵文昌航天发射场。",www.cnsa.gov.cn,Web,https://www.cnsa.gov.cn/n6758823/n6758838/c10762022/content.html,S_Core,,4,3,4,3.70,A,中圈载体,Yes,可能影响太空算力的部署节奏、硬件供给或应用边界。,用于校准产业路线、合作对象和资本节奏。,跟踪后续官方文件、技术参数、订单或融资交割。,Pass A discovery; Pass C date-window structured result,Yes
W29-E080,2026-07-14,2026-07-14,China,科技,Technology,,单忠德会见沙特通信和信息技术大臣、沙特航天局董事会主席阿卜杜拉·苏瓦哈,单忠德会见沙特通信和信息技术大臣、沙特航天局董事会主席阿卜杜拉·苏瓦哈,www.cnsa.gov.cn,Web,https://www.cnsa.gov.cn/n6758823/n6758838/c10762345/content.html,S_Core,,4,3,3,3.50,B,中圈载体,Brief,可能影响太空算力的部署节奏、硬件供给或应用边界。,用于校准产业路线、合作对象和资本节奏。,跟踪后续官方文件、技术参数、订单或融资交割。,Pass A discovery; Pass C date-window structured result,Yes
W29-E081,2026-07-17,2026-07-17,China,科技,Technology,,单忠德赴上海航天技术研究院调研重点型号研制工作并看望科研生产一线人员,"7月16日,国家航天局局长单忠德带队赴上海航天技术研究院,督导检查重点型号研制、安全生产等工作并与科研生产一线人员座谈交流。强调我们要深入贯彻落实习近平总书记关于航天强国建设的重要论述和重要指示批示精神,不折不扣贯彻落实党中央、国务院决策部署,把高质量发展要求贯穿型号研制、科研生产等全过程各环节,扎扎实实推动各项重点任务顺利实施。",www.cnsa.gov.cn,Web,https://www.cnsa.gov.cn/n6758823/n6758838/c10763040/content.html,S_Core,,4,4,3,3.80,B,编辑降级：评论或常规调研动态，不作为S/A重点,Brief,可能影响太空算力的部署节奏、硬件供给或应用边界。,用于校准产业路线、合作对象和资本节奏。,跟踪后续官方文件、技术参数、订单或融资交割。,Pass A discovery; Pass C date-window structured result,Yes
W29-E082,2026-07-13,2026-07-13,China,政策,Policy,,昆明市工业和信息化局2026年行政许可信息公示(2026年7月6日至7月10日)-行政许可-昆明市工业和信息化局,昆明市工业和信息化局2026年行政许可信息公示(2026年7月6日至7月10日),gxj.km.gov.cn,Web,https://gxj.km.gov.cn/c/2026-07-13/5096882.shtml,S_Core,,1,3,3,2.00,C,弱相关,Exclude,作为地面算力与芯片供给侧对照。,用于校准产业路线、合作对象和资本节奏。,跟踪后续官方文件、技术参数、订单或融资交割。,Pass A discovery; Pass C date-window structured result,Yes
W29-E083,2026-07-13,2026-07-13,China,政策,Policy,,行政许可结果- 重庆市经济和信息化委员会,序号,jjxxw.cq.gov.cn,Web,http://jjxxw.cq.gov.cn/zwgk_213/fdzdgknr/xzxk_176746/xzxkjg763/202607/t20260713_15818560.html,S_Core,,1,3,3,2.00,C,弱相关,Exclude,作为地面算力与芯片供给侧对照。,用于校准产业路线、合作对象和资本节奏。,跟踪后续官方文件、技术参数、订单或融资交割。,Pass A discovery; Pass C date-window structured result,Yes
W29-E084,2026-07-13,2026-07-13,China,政策,Policy,,2026年7月行政许可事项(网文)(7.7-7.10)_重庆市文化和旅游发展委员会,[,whlyw.cq.gov.cn,Web,http://whlyw.cq.gov.cn/zwgk_221/fdzdgknr/xzxk/xzxkjg/whxzxkjg/202607/t20260713_15818364.html,S_Core,,1,3,3,2.00,C,弱相关,Exclude,作为地面算力与芯片供给侧对照。,用于校准产业路线、合作对象和资本节奏。,跟踪后续官方文件、技术参数、订单或融资交割。,Pass A discovery; Pass C date-window structured result,Yes
W29-E085,2026-07-13,2026-07-13,China,政策,Policy,,2026年7月6日-2026年7月10日规划许可批后公示,12491323,zygh.changsha.gov.cn,Web,http://zygh.changsha.gov.cn/zfxxgk/fdzdgknr/xzxk/xzxk2020/202607/t20260713_12491323.html,S_Core,,1,3,3,2.00,C,弱相关,Exclude,作为地面算力与芯片供给侧对照。,用于校准产业路线、合作对象和资本节奏。,跟踪后续官方文件、技术参数、订单或融资交割。,Pass A discovery; Pass C date-window structured result,Yes
W29-E086,2026-07-17,2026-07-17,China,政策,Policy,,2026年湖北省经济和信息化厅无线电行政许可事项办结情况汇总表(6.1-6.30)-湖北省经济和信息化厅,2026年湖北省经济和信息化厅无线电行政许可事项办结情况汇总表(6.1-6.30)序号行政相对人业务主题行政许可内容执照编号执照有效期办结日期办理状态收件时间1关于沃尔玛(湖北)商业零售有限公司光谷山姆会员商店无线电台(站)的设置、使用审批(续用)的业务无线电台(站)的设置、使用审批(续用)2026S4201FB00000032028061520260608准予许可202605292关于沃尔玛(湖北)商业零售有限公司光谷山姆会员商店无线电台(站)的设置、使用审批(续用)的业务无线电台(站)的设置、使用审批(续用)2026S4201ML00000042028061520260608准予许可202605293关于黔张常铁路有限责任公司无线电台(站)的设置、使用审批(续用)的业务无线电台(站)的设置、使用审批(续用)2026S4200FB00001322029063020260611准予许可202605274关于黔张常铁路有限责任公司无线电台(站)的设置、使用审批(续用)的业务无线电台(站)的设置、使用审批(续用)2026S4200FB00001332029063020260611准予许可202605275关于黔张常铁路有限责任公司无线电台(站)的设置、使用审批(续用)的业务无线电台(站)的设置、使用审批(续用)2026S4200FB00001342029063020260611准予许可202605276关于黔张常铁路有限责任公司无线电台(站)的设置、使用审批(续用)的业务无线电台(站)的设置、使用审批(续用)2026S4200FB00001352029063020260611准予许可202605277关于黔张常铁路有限责任公司无线电台(站)的设置、使用审批(续用)的业务无线电台(站)的设置、使用审批(续用)2026S4200FB00001362029063020260611准予,jxt.hubei.gov.cn,Web,http://jxt.hubei.gov.cn/fbjd/xxgkml/xkfw/xzxkjg_jxt/202607/t20260717_5979107.shtml,S_Core,,1,3,3,2.00,C,弱相关,Exclude,作为地面算力与芯片供给侧对照。,用于校准产业路线、合作对象和资本节奏。,跟踪后续官方文件、技术参数、订单或融资交割。,Pass A discovery; Pass C date-window structured result,Yes
W29-E087,2026-07-17,2026-07-17,China,政策,Policy,,公路行政许可信息2026.07.13-2026.07.17-武汉市交通运输局,公路行政许可信息2026.07.13-2026.07.17,jtj.wuhan.gov.cn,Web,https://jtj.wuhan.gov.cn/zwgk/zfxxgkml/xkfw/xzxk22/202607/t20260717_2822471.shtml,S_Core,,1,3,3,2.00,C,弱相关,Exclude,作为地面算力与芯片供给侧对照。,用于校准产业路线、合作对象和资本节奏。,跟踪后续官方文件、技术参数、订单或融资交割。,Pass A discovery; Pass C date-window structured result,Yes
W29-E088,2026-07-16,2026-07-16,China,政策,Policy,,2026年7月14日探矿权勘查许可办理情况表,2026年7月14日探矿权勘查许可办理情况表,bnr.jiangxi.gov.cn,Web,http://bnr.jiangxi.gov.cn/jxszrzyt/spjg1/pc/content/content_2077659145069830144.html,S_Core,,1,3,3,2.00,C,弱相关,Exclude,作为地面算力与芯片供给侧对照。,用于校准产业路线、合作对象和资本节奏。,跟踪后续官方文件、技术参数、订单或融资交割。,Pass A discovery; Pass C date-window structured result,Yes
W29-E089,2026-07-16,2026-07-16,China,政策,Policy,,2026年7月第2周建设用地规划许可证批后公告,2026年7月第2周建设用地规划许可证批后公告,zrzyghj.pds.gov.cn,Web,https://zrzyghj.pds.gov.cn/contents/11970/24686.html,S_Core,,1,3,3,2.00,C,弱相关,Exclude,作为地面算力与芯片供给侧对照。,用于校准产业路线、合作对象和资本节奏。,跟踪后续官方文件、技术参数、订单或融资交割。,Pass A discovery; Pass C date-window structured result,Yes
W29-E090,2026-07-15,2026-07-15,China,科技,Technology,,国家广播电视总局 公告公示 国务院广播电视行政部门审批设立的卫星地面接收设施安装服务机构名录(截至2026年7月6日),国务院广播电视行政部门审批设立的卫星地面接收设施安装服务机构名录(截至2026年7月6日),www.nrta.gov.cn,Web,http://www.nrta.gov.cn/art/2026/7/15/art_113_72392.html,S_Core,,4,4,3,3.80,B,正文覆盖校准：官方或技术链补充信号，仅作Brief,Brief,可能影响太空算力的部署节奏、硬件供给或应用边界。,用于校准产业路线、合作对象和资本节奏。,跟踪后续官方文件、技术参数、订单或融资交割。,Pass A discovery; Pass C date-window structured result,Yes
W29-E091,2026-07-17,2026-07-17,China,政策,Policy,,2026年行政许可事项公示内容(二十) - 青海无线电管理办公室,79、宋斌申请新设及延期使用业余无线电台获得许可,www.qinghai.gov.cn,Web,http://www.qinghai.gov.cn/qhww/zt1/4208.jsp,S_Core,,1,3,3,2.00,C,弱相关,Exclude,作为地面算力与芯片供给侧对照。,用于校准产业路线、合作对象和资本节奏。,跟踪后续官方文件、技术参数、订单或融资交割。,Pass A discovery; Pass C date-window structured result,Yes
